[
  {
    "id": "sauda-001",
    "docId": "sauda-kravspek-v2",
    "page": 3,
    "section": "Omfanget av leveransen",
    "quote": "Anleggene skal være ferdigstilt innen 01.06.2025.",
    "quoteVerified": true,
    "obligation": "must",
    "category": "commercial",
    "role": "frist",
    "status": "forslag",
    "proposedBy": "data-1 (Claude Opus 5.5) 2026-10-17",
    "reviewedBy": null,
    "note": null
  },
  {
    "id": "sauda-002",
    "docId": "sauda-kravspek-v2",
    "page": 3,
    "section": "Omfanget av leveransen",
    "quote": "Tilbyder skal levere komplette, ferdig tilkoblede og idriftsatt anlegg, inkludert prosjektering, materiell, installasjon, nettilknytning, overvåkning, prøvedrift, FDV-dokumentasjon og samsvarserklæring.",
    "quoteVerified": true,
    "obligation": "must",
    "category": "functional",
    "role": "kravspesifikasjon",
    "status": "forslag",
    "proposedBy": "data-1 (Claude Opus 5.5) 2026-10-17",
    "reviewedBy": null,
    "note": null
  },
  {
    "id": "sauda-003",
    "docId": "sauda-kravspek-v2",
    "page": 3,
    "section": "Omfanget av leveransen",
    "quote": "Leveransen skal omfatte alt nødvendig utstyr, som solcellemoduler, montasjesystem, vekselrettere, kabler, brytere, overspenningsvern og målere.",
    "quoteVerified": true,
    "obligation": "must",
    "category": "technical",
    "role": "kravspesifikasjon",
    "status": "forslag",
    "proposedBy": "data-1 (Claude Opus 5.5) 2026-10-17",
    "reviewedBy": null,
    "note": null
  },
  {
    "id": "sauda-004",
    "docId": "sauda-kravspek-v2",
    "page": 3,
    "section": "Omfanget av leveransen",
    "quote": "Entreprenør er ansvarlig for eventuelle skader på eiendommene under leveransen",
    "quoteVerified": true,
    "obligation": "must",
    "category": "legal",
    "role": "kontraktsvilkår",
    "status": "forslag",
    "proposedBy": "data-1 (Claude Opus 5.5) 2026-10-17",
    "reviewedBy": null,
    "note": null
  },
  {
    "id": "sauda-005",
    "docId": "sauda-kravspek-v2",
    "page": 4,
    "section": "Omfanget av leveransen",
    "quote": "forskrifter og HMS-krav for arbeid i høyden skal følges.",
    "quoteVerified": true,
    "obligation": "must",
    "category": "legal",
    "role": "kravspesifikasjon",
    "status": "forslag",
    "proposedBy": "data-1 (Claude Opus 5.5) 2026-10-17",
    "reviewedBy": null,
    "note": null
  },
  {
    "id": "sauda-006",
    "docId": "sauda-kravspek-v2",
    "page": 4,
    "section": "Omfanget av leveransen",
    "quote": "Entreprenør skal inkludere alle kostnader til transport, rigging og spesialisert utstyr, samt stillas og taksikring.",
    "quoteVerified": true,
    "obligation": "must",
    "category": "commercial",
    "role": "tilbudsinnhold",
    "status": "forslag",
    "proposedBy": "data-1 (Claude Opus 5.5) 2026-10-17",
    "reviewedBy": null,
    "note": null
  },
  {
    "id": "sauda-007",
    "docId": "sauda-kravspek-v2",
    "page": 4,
    "section": "Generelle krav til solcelleanlegget",
    "quote": "skal entreprenør også legge frem forventet årlig og månedlig energiproduksjon ved bruk av et anerkjent simuleringsprogram",
    "quoteVerified": true,
    "obligation": "must",
    "category": "technical",
    "role": "tilbudsinnhold",
    "status": "forslag",
    "proposedBy": "data-1 (Claude Opus 5.5) 2026-10-17",
    "reviewedBy": null,
    "note": null
  },
  {
    "id": "sauda-008",
    "docId": "sauda-kravspek-v2",
    "page": 4,
    "section": "Solcellemoduler",
    "quote": "Skal minimum ha sertiﬁsering SA8000:2014 eller OHSAS 18001",
    "quoteVerified": true,
    "obligation": "must",
    "category": "technical",
    "role": "kravspesifikasjon",
    "status": "forslag",
    "proposedBy": "data-1 (Claude Opus 5.5) 2026-10-17",
    "reviewedBy": null,
    "note": null
  },
  {
    "id": "sauda-009",
    "docId": "sauda-kravspek-v2",
    "page": 4,
    "section": "Solcellemoduler",
    "quote": "Skal ha EPD ihht. ISO 14025:2006 og EN 15804:2012+A2:2019/AC:2021.",
    "quoteVerified": true,
    "obligation": "must",
    "category": "technical",
    "role": "kravspesifikasjon",
    "status": "forslag",
    "proposedBy": "data-1 (Claude Opus 5.5) 2026-10-17",
    "reviewedBy": null,
    "note": null
  },
  {
    "id": "sauda-010",
    "docId": "sauda-kravspek-v2",
    "page": 4,
    "section": "Solcellemoduler",
    "quote": "Skal ha LCA som viser produktets miljøpåvirkning og livssyklus.",
    "quoteVerified": true,
    "obligation": "must",
    "category": "technical",
    "role": "kravspesifikasjon",
    "status": "forslag",
    "proposedBy": "data-1 (Claude Opus 5.5) 2026-10-17",
    "reviewedBy": null,
    "note": null
  },
  {
    "id": "sauda-011",
    "docId": "sauda-kravspek-v2",
    "page": 4,
    "section": "Solcellemoduler",
    "quote": "TUV NORD sertiﬁsert IEC 61215-1:2021",
    "quoteVerified": true,
    "obligation": "must",
    "category": "technical",
    "role": "kravspesifikasjon",
    "status": "forslag",
    "proposedBy": "data-1 (Claude Opus 5.5) 2026-10-17",
    "reviewedBy": null,
    "note": null
  },
  {
    "id": "sauda-012",
    "docId": "sauda-kravspek-v2",
    "page": 4,
    "section": "Solcellemoduler",
    "quote": "Class one ﬁre prevention certiﬁcation",
    "quoteVerified": true,
    "obligation": "must",
    "category": "security",
    "role": "kravspesifikasjon",
    "status": "forslag",
    "proposedBy": "data-1 (Claude Opus 5.5) 2026-10-17",
    "reviewedBy": null,
    "note": null
  },
  {
    "id": "sauda-013",
    "docId": "sauda-kravspek-v2",
    "page": 4,
    "section": "Solcellemoduler",
    "quote": "Helsorte, N-Type, glass glass, bifacial.",
    "quoteVerified": true,
    "obligation": "must",
    "category": "technical",
    "role": "kravspesifikasjon",
    "status": "forslag",
    "proposedBy": "data-1 (Claude Opus 5.5) 2026-10-17",
    "reviewedBy": null,
    "note": null
  },
  {
    "id": "sauda-014",
    "docId": "sauda-kravspek-v2",
    "page": 4,
    "section": "Solcellemoduler",
    "quote": "Minimum 25 års kvalitets garanti.",
    "quoteVerified": true,
    "obligation": "must",
    "category": "commercial",
    "role": "kravspesifikasjon",
    "status": "forslag",
    "proposedBy": "data-1 (Claude Opus 5.5) 2026-10-17",
    "reviewedBy": null,
    "note": null
  },
  {
    "id": "sauda-015",
    "docId": "sauda-kravspek-v2",
    "page": 4,
    "section": "Solcellemoduler",
    "quote": "Minst 0,4% degradering og linjæreffekt minimum 85% etter 25 år i forhold til STC eller bedre.",
    "quoteVerified": true,
    "obligation": "must",
    "category": "technical",
    "role": "kravspesifikasjon",
    "status": "forslag",
    "proposedBy": "data-1 (Claude Opus 5.5) 2026-10-17",
    "reviewedBy": null,
    "note": "Rettet 2026-10-18 (data-1, gjennomgang med learning-1): sitatet er utvidet til hele setningen, og kravet står i andre halvdel. Sitatet følger uttrekkeren etter ligaturfiksen (PR om fixLigatures, 2026-10-18), som gjør «Ư» om til «ff». Mellomrommet i «linjæreffekt» mangler i PDF-en selv."
  },
  {
    "id": "sauda-016",
    "docId": "sauda-kravspek-v2",
    "page": 4,
    "section": "Solcellemoduler",
    "quote": "20% effektivitet eller høyere.",
    "quoteVerified": true,
    "obligation": "must",
    "category": "technical",
    "role": "kravspesifikasjon",
    "status": "forslag",
    "proposedBy": "data-1 (Claude Opus 5.5) 2026-10-17",
    "reviewedBy": null,
    "note": "Rettet 2026-10-18 (data-1): sitatet manglet ligaturen («e ektivitet», pdftotext). Sitatet følger uttrekkeren etter ligaturfiksen (PR om fixLigatures, 2026-10-18), som gjør «Ư» om til «ff». Mellomrommet i «linjæreffekt» mangler i PDF-en selv."
  },
  {
    "id": "sauda-017",
    "docId": "sauda-kravspek-v2",
    "page": 4,
    "section": "Vekselrettere",
    "quote": "Skal tilfredsstille krav for montering mot 230V IT anlegg.",
    "quoteVerified": true,
    "obligation": "must",
    "category": "technical",
    "role": "kravspesifikasjon",
    "status": "forslag",
    "proposedBy": "data-1 (Claude Opus 5.5) 2026-10-17",
    "reviewedBy": null,
    "note": null
  },
  {
    "id": "sauda-018",
    "docId": "sauda-kravspek-v2",
    "page": 4,
    "section": "Vekselrettere",
    "quote": "Skal minimum følge disse standardene IEC 62109-1 og IEC 62109-2",
    "quoteVerified": true,
    "obligation": "must",
    "category": "technical",
    "role": "kravspesifikasjon",
    "status": "forslag",
    "proposedBy": "data-1 (Claude Opus 5.5) 2026-10-17",
    "reviewedBy": null,
    "note": null
  },
  {
    "id": "sauda-019",
    "docId": "sauda-kravspek-v2",
    "page": 4,
    "section": "Vekselrettere",
    "quote": "Minimum 97% effektivitet.",
    "quoteVerified": true,
    "obligation": "must",
    "category": "technical",
    "role": "kravspesifikasjon",
    "status": "forslag",
    "proposedBy": "data-1 (Claude Opus 5.5) 2026-10-17",
    "reviewedBy": null,
    "note": "Rettet 2026-10-18 (data-1): sitatet manglet ligaturen («e ektivitet», pdftotext). Sitatet følger uttrekkeren etter ligaturfiksen (PR om fixLigatures, 2026-10-18), som gjør «Ư» om til «ff». Mellomrommet i «linjæreffekt» mangler i PDF-en selv."
  },
  {
    "id": "sauda-020",
    "docId": "sauda-kravspek-v2",
    "page": 4,
    "section": "Vekselrettere",
    "quote": "Vekselrettere skal dimensjoneres mellom 95 – 130%.",
    "quoteVerified": true,
    "obligation": "must",
    "category": "technical",
    "role": "kravspesifikasjon",
    "status": "forslag",
    "proposedBy": "data-1 (Claude Opus 5.5) 2026-10-17",
    "reviewedBy": null,
    "note": null
  },
  {
    "id": "sauda-021",
    "docId": "sauda-kravspek-v2",
    "page": 4,
    "section": "Vekselrettere",
    "quote": "Dersom vekselretter monteres utendørs, skal det etableres beslag og eller kapslinger",
    "quoteVerified": true,
    "obligation": "must",
    "category": "technical",
    "role": "kravspesifikasjon",
    "status": "forslag",